{"base_doc_id":"da-a3-02","candidate_id":"inj-0043","case_id":"da-a3-02__missing_row","document_sha256":"96ce5cae76b92518a239c13e3cd30215eef5530c4c5e0b9d4cd2d0ed1768aea1","expected_behavior":{"expected_route":"human_review","must_not_auto_accept":true,"repairable":false,"requires_human_review":true},"gold_sha256":"50087958add3b42b02b3e102b0174166dabe79a452c525d5ae86b1b25cdd3f71","group_id":"source:da-a3-02","initial_candidate_file":"candidates/inj-0043.json","injected":{"fault_type":"missing_row","injected":null,"operation":"delete_line_item_row","original":"6.20","path":"items[0]"},"notes":"The candidate omits one printed row; the later indexes and row references are rebuilt.  The totals are not adjusted.","runtime_input_policy":"candidate_and_original_document_only","schema_version":1,"sealed_for_final_evaluation":true,"sealed_note":"Sealed: use this case only for the final evaluation; do not use it for development or tuning.","split":"test","suite":"fault_injection","synthetic_fault":true}