{"base_doc_id":"da-a1-05","candidate_id":"inj-0024","case_id":"da-a1-05__duplicate_row","document_sha256":"a1f7785128e41003d4687944d01c14910b8a50cf5243fd3bf22c6417c4eb9a00","expected_behavior":{"expected_route":"human_review","must_not_auto_accept":true,"repairable":false,"requires_human_review":true},"gold_sha256":"00362df05b224b201655fca2808a0ecaefd6b2f8b052ef387f8ecdd00ebde55d","group_id":"source:da-a1-05","initial_candidate_file":"candidates/inj-0024.json","injected":{"fault_type":"duplicate_row","injected":"76.80","operation":"duplicate_line_item_row","original":"76.80","path":"items[0]"},"notes":"The candidate reports one printed row twice; the later indexes and row references are rebuilt.  The totals are not adjusted.","runtime_input_policy":"candidate_and_original_document_only","schema_version":1,"sealed_for_final_evaluation":true,"sealed_note":"Sealed: use this case only for the final evaluation; do not use it for development or tuning.","split":"test","suite":"fault_injection","synthetic_fault":true}