{"base_doc_id":"da-a1-04","candidate_id":"inj-0016","case_id":"da-a1-04__unit_decimal_shift","document_sha256":"ee0f93e1cf333abc50e4619a22ccc3c87a347eba01a72f51f1eebd9e490cc6dc","expected_behavior":{"expected_route":"patch_and_reverify","must_not_auto_accept":true,"repairable":true,"requires_human_review":false},"gold_sha256":"475ffe50e2ae806243c1421123ded016e141d474297911a27ccf2225d834a931","group_id":"source:da-a1-04","initial_candidate_file":"candidates/inj-0016.json","injected":{"fault_type":"unit_decimal_shift","injected":"24.00","operation":"multiply_unit_price_by_ten","original":"2.40","path":"items[0].unit_price"},"notes":"The candidate reads the unit price ten times too large; the line amount, the subtotal and the total stay as printed.","runtime_input_policy":"candidate_and_original_document_only","schema_version":1,"sealed_for_final_evaluation":true,"sealed_note":"Sealed: use this case only for the final evaluation; do not use it for development or tuning.","split":"test","suite":"fault_injection","synthetic_fault":true}