{"base_doc_id":"da-a3-01","candidate_id":"inj-0039","case_id":"da-a3-01__duplicate_row","document_sha256":"f65e51f3c562dcba9067927b38991c4e1c5698253b4835c229472be43963bf57","expected_behavior":{"expected_route":"human_review","must_not_auto_accept":true,"repairable":false,"requires_human_review":true},"gold_sha256":"cb5b8a55348358afd122a039bcb2604b25189aa855d7b789e20484fada21bdff","group_id":"source:da-a3-01","initial_candidate_file":"candidates/inj-0039.json","injected":{"fault_type":"duplicate_row","injected":"6.20","operation":"duplicate_line_item_row","original":"6.20","path":"items[0]"},"notes":"The candidate reports one printed row twice; the later indexes and row references are rebuilt.  The totals are not adjusted.","runtime_input_policy":"candidate_and_original_document_only","schema_version":1,"sealed_for_final_evaluation":false,"sealed_note":"Development case: it may be used to check repair behaviour; it is not part of the sealed test split.","split":"dev","suite":"fault_injection","synthetic_fault":true}