{"base_doc_id":"da-a1-02","candidate_id":"inj-0008","case_id":"da-a1-02__missing_row","document_sha256":"03858267df757edb7018ff9c74e765bff138947e888a1ccbd9a2122ca81d5ec4","expected_behavior":{"expected_route":"human_review","must_not_auto_accept":true,"repairable":false,"requires_human_review":true},"gold_sha256":"03a100675998b18b547c81e0e1153a086b645d3265e6fd5eb7862c9e76a0ea00","group_id":"source:da-a1-02","initial_candidate_file":"candidates/inj-0008.json","injected":{"fault_type":"missing_row","injected":null,"operation":"delete_line_item_row","original":"84.60","path":"items[0]"},"notes":"The candidate omits one printed row; the later indexes and row references are rebuilt.  The totals are not adjusted.","runtime_input_policy":"candidate_and_original_document_only","schema_version":1,"sealed_for_final_evaluation":false,"sealed_note":"Development case: it may be used to check repair behaviour; it is not part of the sealed test split.","split":"dev","suite":"fault_injection","synthetic_fault":true}