{"base_doc_id":"da-a4-01","candidate_id":"inj-0050","case_id":"da-a4-01__tax_null","document_sha256":"28d972e09261f6c07af56b4d2c8f7af86b6ff1616b95ee50795ccc7b6d88c8bd","expected_behavior":{"expected_route":"patch_and_reverify","must_not_auto_accept":true,"repairable":true,"requires_human_review":false},"gold_sha256":"63e7146db78109630cf01d2dba8850a29d3b8a2c22b7a6b06dc67cd2995f65cc","group_id":"source:da-a4-01","initial_candidate_file":"candidates/inj-0050.json","injected":{"fault_type":"tax_null","injected":null,"operation":"set_tax_amount_unreadable","original":"0.00","path":"tax_amount"},"notes":"The candidate does not find the printed tax amount.  The printed value stays only in this envelope, never in the candidate.","runtime_input_policy":"candidate_and_original_document_only","schema_version":1,"sealed_for_final_evaluation":true,"sealed_note":"Sealed: use this case only for the final evaluation; do not use it for development or tuning.","split":"test","suite":"fault_injection","synthetic_fault":true}