{"base_doc_id":"da-a4-01","candidate_id":"inj-0047","case_id":"da-a4-01__line_digit_transpose","document_sha256":"28d972e09261f6c07af56b4d2c8f7af86b6ff1616b95ee50795ccc7b6d88c8bd","expected_behavior":{"expected_route":"patch_and_reverify","must_not_auto_accept":true,"repairable":true,"requires_human_review":false},"gold_sha256":"63e7146db78109630cf01d2dba8850a29d3b8a2c22b7a6b06dc67cd2995f65cc","group_id":"source:da-a4-01","initial_candidate_file":"candidates/inj-0047.json","injected":{"fault_type":"line_digit_transpose","injected":"67.80","operation":"swap_adjacent_digits_in_line_amount","original":"76.80","path":"items[0].line_net_amount"},"notes":"The candidate transposes two adjacent digits of one line amount; every other printed value stays as printed.","runtime_input_policy":"candidate_and_original_document_only","schema_version":1,"sealed_for_final_evaluation":true,"sealed_note":"Sealed: use this case only for the final evaluation; do not use it for development or tuning.","split":"test","suite":"fault_injection","synthetic_fault":true}