{"base_doc_id":"da-a1-02","candidate_id":"inj-0010","case_id":"da-a1-02__tax_null","document_sha256":"03858267df757edb7018ff9c74e765bff138947e888a1ccbd9a2122ca81d5ec4","expected_behavior":{"expected_route":"patch_and_reverify","must_not_auto_accept":true,"repairable":true,"requires_human_review":false},"gold_sha256":"03a100675998b18b547c81e0e1153a086b645d3265e6fd5eb7862c9e76a0ea00","group_id":"source:da-a1-02","initial_candidate_file":"candidates/inj-0010.json","injected":{"fault_type":"tax_null","injected":null,"operation":"set_tax_amount_unreadable","original":"13.24","path":"tax_amount"},"notes":"The candidate does not find the printed tax amount.  The printed value stays only in this envelope, never in the candidate.","runtime_input_policy":"candidate_and_original_document_only","schema_version":1,"sealed_for_final_evaluation":false,"sealed_note":"Development case: it may be used to check repair behaviour; it is not part of the sealed test split.","split":"dev","suite":"fault_injection","synthetic_fault":true}